{
  "$schema": "https://json-schema.org/draft/2020-12/schema",
  "$id": "https://openai.local/ai-ip/provider-budget-evidence.schema.json",
  "type": "object",
  "additionalProperties": false,
  "required": ["schemaVersion", "providerLabel", "approvalId", "currency", "accountScopeCommitment", "prepaidOrHardLimitFen", "validFrom", "validUntil"],
  "properties": {
    "schemaVersion": {"const": 1},
    "providerLabel": {"$ref": "#/$defs/label"},
    "approvalId": {"$ref": "#/$defs/label"},
    "currency": {"const": "CNY"},
    "accountScopeCommitment": {"$ref": "#/$defs/sha256"},
    "prepaidOrHardLimitFen": {"$ref": "#/$defs/fen"},
    "validFrom": {"$ref": "#/$defs/timestamp"},
    "validUntil": {"$ref": "#/$defs/timestamp"}
  },
  "$defs": {
    "label": {"type": "string", "pattern": "^[A-Za-z0-9][A-Za-z0-9._:+/@() -]{0,199}$"},
    "timestamp": {"type": "string", "pattern": "^\\d{4}-\\d{2}-\\d{2}T\\d{2}:\\d{2}:\\d{2}\\.\\d{3}Z$"},
    "sha256": {"type": "string", "pattern": "^[0-9a-f]{64}$"},
    "fen": {"type": "integer", "minimum": 0, "maximum": 18446744073709551615}
  }
}
