{
  "schemaVersion": 1,
  "providerLabel": "approved-provider",
  "approvalId": "approval-2026-08-30",
  "currency": "CNY",
  "accountScopeCommitment": "bbbbbbbbbbbbbbbbbbbbbbbbbbbbbbbbbbbbbbbbbbbbbbbbbbbbbbbbbbbbbbbb",
  "prepaidOrHardLimitFen": 800,
  "validFrom": "2026-08-30T10:00:00.000Z",
  "validUntil": "2026-08-31T10:00:00.000Z"
}
